Verse Index{hide},Pranab Gita Translation,Pranab Gita Commentary
"06,07","All of the five “mahabhootas,” “ahamkar,” “buddhi,” “Avyakta,” the ten “indriyas,” “and one more,” and the five objects of the senses, “icchha,” “dvesha,” “sukha,” “duhkha,” “samghaat” (body), “chetana” and “dhriti” – this is a summarized description of the mutation-oriented “kshetra.”","From the Brahman-refuged tri-guna-endowed Maya arises space, from space [emerges] air, from air [emerges] fire, from fire [emerges] water, from water [emerges] earth. These five are the “mahabootas” [primal elements]. What this means is that these are the unformed subtle elements that permeate all manifestations (like ghee within milk); the elements in the state prior to “panchikaran” [manifestation process of the elements; see commentary to sloka 13:2 of the Pranab Gita], the elements that are in their original, non-mutated state, the elements that are not [in this state] perceivable/graspable by the sense-organs – those are called the “mahabootas,” verily. The antahkarana [four-sectioned operating group of personal consciousness] is formed by the sattvic part of the aggregate of those elements. Through the differences in their vrittis [functionalities], that one antahkarana can be perceived as having four aspects. For volition and non-volition, [there is “manas” [mind]];4 for ascertainment and confirmation, there is “buddhi” [intellect]; for self-oriented identifications – meaning: “I” – “I am like this,” “I am like that” – when this type of vritti [active tendency] is taken up, there is “ahamkar” [ego], and the rumination (contemplation) of that which is done [or: to be done] is [performed by] “chitta” [personal consciousness]. “Avyakta” is Maya, endowed with sattva, rajas and tamas gunas. That which cannot be expressed by speech – that is that which is called “Avyakta” [inexpressible; unexpressed]. The ten “indriyas” [sense-organs] are: the five organs of perception and the five organs of action. “And one more” is mind [as a whole]. These are referred to as the eleven “indriyas” [sense-organs]. The five “perceivables” of the senses are: sound, touch, the visible, taste, and scent. The perceivable of the auditory sense is sound; for the somatosensory sense, it is touch; for the eyes, it is form; for the gustatory sense, it is taste; and for the olfactory sense, it is scent.

“Icchha” [desire] – attachment/addiction for [something]; it is the [wish] for the company of something/someone other than me. It is like: the satisfaction that comes from drinking sugared lime-juice sitting while under a banyan tree in the desert-like heat – and then when the same situation happens again, the wistfulness of remembering that previous time, or wanting that same satisfaction from the same thing at that time – that is that which is called “icchha” [want; desire].
 
“Dvesha” [repulsion; hate] – after finding oneself in a jungle of thorny bushes in a dark night, and then, after suffering greatly, finding relief by God’s Grace – the inner feeling that rises up when the memory of that event and state comes about – that is that which is called “dvesha” [repulsion; hate].
 
“Sukha” [pleasing state] – the attainment of something that is supportive. “Duhkha” [painful/sorrowful state] – the attainment of something that is not supportive. (The state that the mind takes on after “sukha” [pleasure] changes into its next phase is called “duhkha” [dissatisfaction; pain; sorrow].)
 
“Samghaat” [organic whole] – unperturbed union – meaning: the union of the atoms and particles have brought about such a state that there is no perception of even a perforation of separation in them in any way. Being like this is called “samghaat.” It is like this: the way that the innumerable atoms and particles are built together – it is as if there is nothing but oneness in this aggregate and there is no doubt that arises that these are not one – oneness like that. This delusion that makes one think that this evident unreality is the Real – this is that which is called “samghaat.”
 
“Chetana” [operating consciousness] – like iron, even though it is by nature dark, hard and cold, becomes pliant, bright and burning hot by the intense application of fire, and just as this is not the actual nature or way of iron – similarly, when Consciousness comes into the impermanent, non-substantial things such as the sense-organs of the body, the consciousness-like activities that are seen – that is that which is called “chetana” [operating consciousness].
 
“Dhriti” = the power of firm holding. The power that allows one to not break off [of an activity or process] because of weariness [physical or mental]. These attributes such as “icchha” etc. are perceivable/visible. Therefore, they are not of the dharma of the Self. They are of the dharma of mind. Therefore, they are the aspects of “kshetra” [see following paragraph].
 
All of these are mutations/mutable. And these mutations, with their presence making up this world and [other] worlds – this is that which is called “kshetra” [field]. Thus is the summarized exemplification (description) of “kshetra.”"
"08,09,10,11,12","Not having self-importance, non-deceit, non-violence, compassion/patience, transparency in behavior, service to sadguru, cleanliness in the external and internal, steadiness on the path to liberation, physical self-control; detachment to the worldly experience, being devoid of egotism, being aware of the painful evil of birth, death, old age and illness; non-attachment to children, spouse, home and such, not feeling oneself to be happy or unhappy because of the [happiness or] unhappiness of one’s children and such, being steady-minded in either good or bad occurrences; unwavering devotion to Me through single-minded yoga, residing in solitude, having a dislike for society; full immersion in spiritual knowledge, and being aware of the goal (Liberation) of the knowledge of Truth – it is said that these, numbering twenty, comprise “jnana” [knowledge]. That which is opposite to this [knowledge] is that which is called “ajnana” [ignorance].","When the Presence of the Knower of the field is known, Immortality is attained. That Knower of the field is also the substance to be known. The Lord speaks about the object of knowledge in the very next statement through statements such as “jneyaṃ yattat pravakshyAmi.” In order to know the substance that is to be known, in order to do the practice to know that wisdom, some qualities such as “amaanitva” [not having self-importance] etc. are necessary. Those qualities such as “amaanitva” etc. are stated by the Lord to be “jnana” [knowledge or acquired qualities that are permanent] that is necessary for the practice of attaining the Knowledge of Truth. Those [qualities] are [or: that “knowledge” is comprised of]:
 
(1) “Amaanitva” [not having self-importance/non-vanity]: “maan” [self-importance/self-orientedness] means delusion of oneself. All of the delusion that there is with oneself is that which is called “sambhram” [associated delusion] or “maan.” Allowing “whatever I am not” to enter into “I” is called “maan.” When that total delusion or acceptance [of the delusion] has an “a” come and stand in front of it [prefix], then the meaning of that acceptance [of self-oriented delusion], or the total delusion itself disappears, and a new meaning appears. Abiding at all times in this new state [of not having self-importance] is called “amaanitva” [being unaware of self-importance]. (2) “Adambhitva” [non-deception; personal transparency] – “dambha” means “deception” – meaning: what I am actually not – showing that sort of pretense (showing off) and endeavoring to cheat/fool people with that pretense is called “dambha” [deceitfulness]. Remaining at all times devoid of the activities of that state is called “adambhitva” [being in a state of non-deception; being personally transparent]. (3) “Ahimsa” [non-aggression] – the non-arising of maleficent functionalities within one’s inner being is called “ahimsa.” (4) “Kshanti” [forgiveness] – the forgiveness that is given even towards the wrongful acts of enemy-powers is that which is called “kshanti.” (5) “Aarjav” means – being simple and honest. (6) Taking refuge in and serving the teacher is called “acharyopasana.” (7) “Shaucha” [cleanliness] – getting rid of the impurities of mind/heart is called “shaucha” [purity]. Sound, touch, sight, taste, smell – these five worldly experiences, and ignorance, pride, attraction, repulsion, fear of death – these five afflictions – [these ten together] are called “impurities of the mind.” Washing off the impurities of the body with water is also called “shaucha” [cleanliness]. Becoming clean is also called “shaucha.” And during the state when the mind is still, and no vrittis [inner activities] arise – the unchanging Stillness that is experienced – that is that which is called “shaucha.” (8) Remaining unmoved even at the time of the events of anxiety is called “sthairya” [steadiness]. (9) The effort to destroy body-vanity/body-identification through special Kriya is that which is called “atmavinigraha” [effort to not hold on to self-orientedness]. (10) “Indiryartheshu vairagya” [detachment from the matters of the sense-organs] – meaning: the experiencing of the worldly experience through the ten sense-organs, and the enjoyment/partaking in them – exercising detachment towards them. (11) Having an acute perception regarding the painful wrongness of “janma-mrityu-jara-vyadhi” [birth, death, old-age and illness] – birth itself is pain/sorrow, as there is pain in the womb, and the pain of birthing-labor is full of suffering. That is why it belongs to “wrongness.” Similarly, the pain of death is an extreme suffering; thus, this also belongs to pain and wrongness. In old age, the mental acumen and the vital force diminish; therefore, this is also pain and wrongness. Similarly, illness is also pain and wrongness. For the jiva [embodied soul] the experiencing of all of these sufferings is inevitable. When there is repeated discussion/analysis about these sufferings and wrongs, detachment towards the body and its sense-organs comes about. Effort ensues towards the renunciation of self-orientedness, and in the end, the Self is witnessed. Therefore, whenever whichever vritti [active tendency] rises within the antahkarana [mind as a whole], one should see that very vritti as the seed of rebirth. Ascertaining that very vritti as the pain of birth, the pain of death, the pain of illness, and thereby destroying that vritti is also jnana-sadhana, and that is why [this awareness of the pains and wrongs] is addressed by the word “knowledge.”
 
“Aasakti” [addiction; attachment] etc.: the best of the things of enjoyment in samsara are children, spouse, and property and such. (13) Not being “aasakta” [addicted; attached] to them and (14) to totally renounce all desire to be together with them. (15) Not having any impressions take hold in the chitta [personal consciousness] by not taking in good or bad when they come about; the chitta remains as is; remaining vigilant in this kind of way at all times.
 
(16) It is “I” Who am “Rama” [the Delightful One; the Beloved] – the unbroken endeavor of “avyabhicharini” [non-adulterous] devotion towards that “I”. (“Vyabhichar” [deviant nature; adulterer-nature] is the name of active functionalities operating in the direction of the worldly experience.) (17) Desolate riversides, mountains, solitary places, cremation grounds or places near them, places of battle,6 sacred places – these are secluded lands and places of sadhana [spiritual practice]; although naturally clean, [further] cleaning these places with cow-dung and such and making use of [these places for spiritual practice]. So goes it for the external. And for the internal: those places such as Muladhar etc. that are in the brahmanadi within the sushumna are the secluded lands; making use of them with the guru-instructed methods. (18) The kinds of people who do not have [spiritual] culture – stopping intimate and distant [or: inner and outer] behavior with them – meaning: not associating with them.
 
[6 Translators’ note: The word used here is “ranasthal” which means “place[s] of battle.” It is very possible that the intended word was “aranyasthal” which has a similar combination of letters with a slight variation and which means “forest dwelling[s].” “Aranyasthal” would fall into the category of “secluded places.”]
 
(19) To know that the “I-ness” pervades every atom and particle of the world – from Brahmaa [the creator] to inanimate objects and to the end of creation – fully digesting this understanding with total surety is called “adhyAtmajnAnanityatvam” [ever being in spiritual knowledge]. (20) “Tattva” [substance; science in the complete sense] is the universe. The goal of the knowledge of this tattva is Brahman, the One Who is Supreme, without any conflict. To merge these two and make them one, and ignoring the way of samsara is “tattvajnAnArtha-darshana” [seeing the goal of the knowledge of tattva]. These twenty are those that are called “jnana” [necessary knowledge]. And whatever is opposite to this – that is that which is called “ajnana” [non-knowledge; ignorance]. (“tattvajne’si yadA pArtha tuShNimbhava tadA sakhe. yaddṛShTaṃ vishvaroopaṃ me mAyAmAtrAṃ tadeva hi. tena bhrAnto’si kaunteya svasvaroopaṃ vichintaya. muhyanti mArayA mooDhAstastvajnA mohavarjitAh.)"
13,"I am speaking about that which is to be known, knowing which, immortality is attained. That is the Beginning-less Supreme Brahman. It cannot be said to be either “sat” [existent] or “asat” [non-existent].","Through analysis, the sadhak [aspirant] has surmised what “field” and “knowledge” are. Now, the sadhak has come to understand what is the final culmination of knowledge – meaning: that thing that is to be known, the substance that is to be known. The word “jneya” means “the object of knowledge” [or: “the thing that is to be known”]. Whatever there is that can be seen in this world – all of that is indeed with beginning and with end – meaning: they follow the way of creation-preservation-destruction. The object of knowledge for those who follow the way of creation-preservation-destruction is That which has no creation-preservation-destruction – That Itself. This is because whatever whoever is – that person automatically knows oneself quite well. That which is not known by someone – that is of course “the thing to be known” for that being. That is why I am saying: those who are of the dharma of death, [of the experiences that] have beginnings and have ends – for them, “the thing to be known” is That – that which is Beginning-less, Invincible [or: Birth-less], Immortal. Knowing which, this suffering of birth and the fear of death – these disappear. And so, gather up the inner functionalities of the worldly experience, and burn the flow of thought with that Boundless, Beginning-less, Infinite-ness [Brahman], like a clump of iron being in fire. It is when this happens that the jiva [individual soul] is delivered from birth and death, and, because of attaining Brahman-ness, attains Immortality. That Brahman is Alone. It is neither “sat” [existent] nor “asat” [non-existent]. (This is because if either “sat” or “asat” is said, duality is implied. That which is without duality or non-duality – That is verily Brahman.)"
14,"That [Brahman] has hands and feet established fully everywhere, has eyes, head and mouth established fully everywhere, has the hearing sense established fully everywhere, and is pervading all of the substances of the worlds/planes of existence. ","When air does not move [much] in a cloud-covered day, causing an oppressive heat, it is not accurate to say in this case that the sky is without air/wind. This is because air/wind, at this time, stays in a state that is not so apparent. Because the touch sense in the jiva [individual incarnation] is very physical/gross in nature, it cannot feel the touch of that very subtle state of air. The subtle can go into the physical. The physical cannot go into the subtle. This is the reason for this [not being able to experience the subtle air]. Similarly, in the Boundless, Infinite Brahman, hands, feet, eyes, hearing, the head which is the container of mental power, and mouth and such – all of the operative powers that there are in creation, all of them are in the “non-apparent but present” state – like salt in salty water – even covering up space itself in Its abyss. “Tat e” – there is no place where this active power is in lesser or greater amounts. The Essence is One and the same everywhere.

 2nd meaning: when the sadhak [practitioner] knows well the grand play of the cosmos, then he/she sees that in this [cosmos] there is revelation by sattva [guna], operation by rajas [guna] and settledness by tamas [guna]. Other than these three, there is no other essence [of visible creation]. The coming together of these three and becoming one is Maya. That Maya also belongs to “I”. And that non-essential Maya’s mutations are again these three [gunas]. Thus, they are emergence-giving and destructive as well. Furthermore, in this, there are three “taap[s]” [pressures; intensities; heats; tensions]. If there is playing around with phenomena, there is a “taap.” That is called “adhibhautik taap” [phenomena-based “taap”]. Playing around with gods, there is another “taap.” That is called “adhidaivik taap” [subtle-world-based “taap”]. And playing around with the Self, there is [yet another] “taap.” That is called “adhyatmik taap” [spiritual “taap”]. This too is a mutation [not Truth]. When this became known with certainty, then the sadhak, in order to be separate from this [the “taaps”], sat down with a type of Kriya that is an activity devoid of cause (meaning: that by which all doing/causality disappears). The deeper the practice of this Kriya went on, the more the sadhak went on seeing that he/she is separate from everything in every stage. When nothing else at all was able to touch the sadhak again, then contraction ended in the sadhak and magnanimity/openness came forth. In this magnanimity/openness, all of the contracted-ness that there was previously – the sadhak took them too and destroyed their contracted states, brought them in to the state of magnanimity/openness, and merged them [both states] into Oneself. Then, both magnanimity/openness and contraction were in “abhaav” [non-state; gone]. This settled state where both [magnanimity/openness and contraction] are in the state of oneness – this settled state is that which is known as the “tadbrahma” [That Brahman] State of the sadhak. The unripened sadhak comes down from this State to samsara and thereafter understands that the previous state of the sadhak’s own Self is that which is called “Tat” [That] (Brahman) – the “Tat” that has hands and feet fully established everywhere, has eyes, head and mouth fully established everywhere, has hearing everywhere, and is pervading all in all of the worlds/planes."
15,"(That Brahman) pervades, and is present in, the functioning of all of the sense-organs, yet [at the same time] is free from all of the sense-organs (therefore, It is not acting as the functions of the senses), is without attachment to anything, and at the same time, It is the foundation of all. It is without the gunas such as sattva etc., yet It is the director of the gunas such as sattva etc. ","The senses reside indeed in the extremely small and boundary-enclosed body. But the operative Shakti [essential power] of the senses, and the essence of that Shakti – like the scent of the earth-element, the liquidity of the water-element, the sight of the fire-element, the touch of the air-element and the sound of the space-element – is all pervading and spread throughout all. In the state of the sadhak mentioned in the previous sloka, because of being in that expansive form, no sign remains of the boundary-enclosed senses and such. That is why It is free from all senses, yet taking the aspects of indriyas, such as gunas [essential qualities], Shakti, and the reflection of the essence, It remains as the foundation- and sustaining-cause of all, blended in with the expanse. In this state, there are no operations of any of the gunas (because this is a state beyond the gunas). That is why this is without contact/association to anything. But when the operation of gunas takes place somewhere, because it is happening within the expanse, according to the terminology of the world of beings [or: worlds/planes], It exists as the director of the gunas. "
16,"It is outside of all phenomena/living beings, inside and also in the inert. It is also in the moving. Because of Its subtleness it is unknown. It is far and it is also near.","Because this “Tat-Brahman” [That Brahman] is extremely subtle, It exists as the same within and without all phenomena/living beings. Thus, It is also within and without the moving and unmoving. Those who are visionaries of the subtle, because they abide in this subtleness, this “tat” [That] is near them. And those who only see the physical/gross [aspects] do not understand any of the meanings of these words. Therefore, It is far away from them."
17,"Although It is Undivided, It resides within all phenomena/living beings as if It is divided. That Substance that is to be known (during the manifested state [of phenomena]) is the sustainer of all phenomena/living beings. (During the destruction-state [of phenomena]) It is the Devourer, and (during the creation-state), It is actively creating with many operations. ","When smoke floats in the sky, it is true that one sees the sky as if it is filled with smoke. However, just as there is no association (mingling) of the smoke and the sky, no mark of smoke remains on the body of the sky, and the space does not become divided either – in the same way, although the phenomena and the upper expanse is seen as the one and same by the ignorant, the true perception is had by eyes of the jnani [wise], [who sees that Brahman] is Unassociated/Unmixed with anything, always apart [from phenomena] and Undivided. It is like this: one Maya has three gunas – at the time of the activity of the rajoguna, there is the dressing up as Brahmaa [the creator] and the happening of creation; at the time of the activity of sattva guna, there is the dressing up as Vishnu and the operative happenings; and at the time of the activity of the tamoguna, there is the Form of Hara [Maheshvara] and the happenings of destruction. Even though this appears to be so, when the three gunas are in repose, nothing at all remains. Only phenomena/beings – to put it straight – [is/are] “apparently embedded” (like silver in mother-of-pearl, the snake in the rope, the knowledge of water in the thirst of the deer, delusion is itself delusion) – like that."
18,"That is the light of all lights such as the sun etc. (revealer). And it is said to be beyond tamah [darkness] (meaning: untouched by ignorance). (That is that which is) knowledge, the object of knowledge, that which is to be attained through knowledge and is seated (in the hearts) of all living beings as the controller.","“Jyotish” means the moon, sun and fire [and such light-emitting/light-reflecting substances], those whose light removes the darkness perceived by the physical eyes and allows one to see properly. And another “jyotish” is “jyotish-vidya” [astrology], by which, through its mathematical analyses, the projected resolutions of things can be known. And “jyotish” [is also], self-understanding (like: I used to play during childhood; now I am in old age; that place is no more; that time is no more; that participant is also not there; yet I am seeing them in memory as if they are happening now; like that) – that which shows in the future as if it is in the present. These few types of “jyotish” are contents of the aforementioned “Tat.” Therefore, “Tat” is light of even the revealers. This “Tat” is ever-existent on the other side of [is beyond] darkness. This “Tat” is right after the final state of “knowledge” [as stated in slokas 13:8-12]. The object to be known is also this “Tat.” Through knowledge, one has to fall into this “Tat” and take up Eternal Peace. That which is meant by the word “sarva” [all], within its heart – meaning: [“Tat” is] within it, and because It is Boundless, It is also outside that “sarva” – the “Tat” is there in its Fullness. “Sarva” is in the abyss of “Tat,” like the way the Earth is in the abyss of space. "
