Verse Index{hide},Pranab Gita Translation,Pranab Gita Commentary
19,"The field, knowledge and the object of knowledge have now been stated in this summarized way. Knowing this, My devotee becomes fit to attain My State. ","From the primal elements to the foundation is the “field.” From the qualities such as “amaanitva” [not having self-importance] to the witnessing of the goal of spiritual knowledge is “knowledge.” And from “Beginning-less ‘I’” to “residing within the hearts of all” is the “object of knowledge.” I have told you about these in summarized form. The one who is the devotee of “I” (meaning: the one who has suffered the torture of the ocean of samsara and is going to go and merge in “I” and get Emancipation) – if he/she discusses these three matters and becomes aware of the Form of “Tat,” that being will be intoxicated by the State of “I” and will get “I”."
20,Know that both Prakriti and Purush are beginning-less. Know that all permutations and gunas [qualities] manifest from Prakriti.,"[In the seventh chapter [of the Bhagavad Gita], the matter of two Prakritis by the names of “apara” and “Para,” which represent the Lord’s “field and knower of the field” [respectively], have been stated. At that time, it was said that all phenomena and living beings are born of this dual Prakriti. How all phenomena and living beings arise from that dual Prakriti –  signifying the field and the knower of the field – in order to explain that, the Lord is now describing the signs and such of Prakriti and Purush.]
Now the sadhak is enquiring into Prakriti and Purush. “Prakriti”: “pra” = “prakrishta” [most excellent] one who does “kriti” [manifestations]. Therefore, it is now determined that the one who acts is called “Prakriti.” “Purush” is the name of the one who is laying down in the “abode” [or: is completely laying down]. Both of these are “anadi” [beginning-less] (those who have not had birth until even now). “Na [negation] adi [beginning]” = “anadi” [without beginning]. If the meaning of the word “Brahman” is analyzed, [it means:] with the root “briha” = expanse, the great; and “man” means “without limit.” The meaning of the word “Brahman” is “the Great Infinity.” For as far as the rulership of this Great Infinity is, for that far there is no place for anything else; only Brahman is Present. Whatever I can see in the visible world, there is a name for that, a form for that as well. And there are also statements which refer to things that cannot be found, like: “flower in the sky,” “horse’s egg,”  “barren woman’s son,” “camel’s horn” etc. While being under the rulership of the word Brahman, if one wants to understand Maya, Prakriti, and Purush, one should think of them as if they are like those words which refer to nothing that actually exists, like aberrations of imagination or falsehoods. Although those imaginary words/statements have no reality – just as those functions that accompany their meanings are [nevertheless] there, it is the same for the meanings of these words: Maya, Prakriti, Purush. That is why, in order to totally free the jivas [souls] from their suffering, the great sages have said in spiritual teachings (Vedanta philosophy) that only Brahman is True, other than That, everything else – Maya, Prakriti, Purush – is false. When the word “Satya” [Truth] appears, just as, right with that [utterance] (even it is not there), the understanding of an opposing word “mithya” [false] comes about – it is like that with the words Maya-Prakriti-Purush [being false] in the “Satya Brahman” [Brahman-Reality]. Brahman is the Eternal Reality, without mutations. And Maya is impermanent, unreal, and nothing but mutations. Brahman and Maya, like body and shadow – one does not stay without the other. This Maya is inert, non-substantial; and Brahman is Awareness/Consciousness Substance Itself. Through their intense relationship, there comes about a delusional understanding of the non-substantial being substantial (like the reflection of the body in the mirror). It is verily then that Maya dresses up as Brahman – meaning: gives forth the idea that [Maya is] the Real and mutation-less. This inverse dressing-up by Maya – this indeed is “Prakriti.” When this Prakriti became big – it is then that She swallowed Brahman in Her belly, like the sky [being reflected] in the pond, or making a house with covered roof in the great space. Covered roof – the floor is “pur” [abode], and the void within the abyss of that “pur” is “Purush.” Just as the salt-water of the sea, taking on the qualities of fire, air and space, and abandoning its own qualities of saltiness, comes down as pure, satisfying and life-giving substance for the world of beings – similarly, due to residing with the extremely low-level and small [types of] natures, Purush also takes on the name of “jiva” [individual person], and, losing all sensibility, dresses up and sits as Prakriti. That is why this one is called “Para Prakriti.” That is because, although this being is “non-doing,” due to the wrong influence of the company it keeps, it takes on the ill-repute of a vain enjoyer (even if it does not actually take it on). “SaṃsargajA doshaguNA bhavanti” [the wrongness of qualities is born of association]. Therefore, Prakriti and Purush are both beginning-less. And know that all imaginations of mutations and qualities are in Prakriti itself. "
21,"“Karya” [action], “kaaran” [cause] and “kartritva” [doership] are caused by and associated with Prakriti; it is said. And the experiencing of the aggregate of pleasure, pain and such are associated with Purush; it is said.","That Fundamental Prakriti that has been spoken about – that has mutated and become seven – meaning: five tanmatras [essence of the senses] (sound, touch, sight, taste, smell), intellect and ego. This seven are called “prakriti-vikriti” [mutations of Prakriti]. These make up “kaaran” [cause]. And then again, transforming into sixteen, it takes the name of “vikar” [permutations; further changes] – such as: five primal elements (earth, water, fire, air, space); five organs of perception (eyes, ears, nose, tongue, skin); five organs of action (speech, hands/arms, feet/legs, anus, sex organ) – these fifteen plus mind. The physical body that has come about from the coming together of all of these, that is called “karya” [work; actions]. That is why Prakriti is said to be the cause of actions and causalities. And that Purush? He has no cause. Although He is Boundless, He has gone on to become small due to circumstances, abides in the abyss of the limitedness of Prakriti, and is experiencing pleasure and pain [and such], all born of the qualities of Prakriti. This experiencing is like this: in a pentagonal room there are five corners of space; in a room with seven corners, there are seven corners [of space]; in a circular room the space is circular; like this, [the space] is fragrant in fragrance, full of stench in stench, smokey in smoke – meaning: although space has no such experience within itself, those who are residing in that space go on experiencing those particular pleasures and pains, and the stains of those pleasures and pains go on being smeared on that space which is [actually] unconnected [to the stains and to the residents of that space]. Like this: that space within that room is malodorous, fragrant, smokey, full of darkness etc. Yet, the poor space itself has no such imperfections. Dear sadhak! Here you have your Purush’s experiencing/partaking. Lord! Lord!

It is as if the incredibly beautiful, grand-sport-playing Prakriti’s ascribed attributes make up the roots of the vines of the visible world."
22,The reason for experiencing all of the qualities born of Prakriti is because Purush is within Prakriti. All of the births that take place in its [Prakriti’s] good and bad wombs – the cause of these matters is the association with the gunas. ,"The delusional imaginations that come about within the Limitless due to the transformations (changes) brought about by the activities and causalities of the limited – [they are] like the blue that is seen in the formless sky due to the sky’s depth and the weakness of eyesight. Just as that is never true – in the same way, the lie of the existence of the non-substantial and limited Prakriti in the Still, Limitless Brahman-Substance is just a lie-filled delusion. And the delirium that is the experiencing of that delusion, that delirium is actually “Purush,” as well as “Purush being within Prakriti.” From that kind of delirium rises the delusional experiential functionalities of pleasure and pain [and such] and: “I am happy”; “I am sad”; “I am ignorant”; “I am wise” – these types of distorted concepts [arise], which are like delirium, cutting Brahman into pieces and making up a “Purush,” the experiencer. This is the taking of your attributeless-ness, mixing it with attributes, and giving out the falsehood of calling you “the experiencer of the attributes.” Just as, in the morning, many-colored forms can be seen by the light of the sun’s rays shining on the dew on barley-stalks – meaning: it is like when many kinds of colors can be seen due to the movement of the sun in the dewdrops – it is like that, brother! The qualities of the imaginary Prakritis cause the quality-free Purush to be associated with qualities/attributes. As the qualities of those Prakritis qualities/attributes are brought together within certain perimeters, so are the births of the pieces of Brahman, such as gods, humans etc., taking place in their [appropriate] types of wombs, and [the births of] animals, birds, insects, creepers etc. taking place in lower kinds of wombs. "
23,"Even though He abides in the body, Purush is beyond (meaning: He is separate from Prakriti), and therefore, He is the overseer, the consenter/manager, the experiencer and the Supreme Lord, and, it is also said that He is the Supreme Self.","The farmer is the protector of the farm, the overseer of the good and bad of all things related to farming. Remaining close to all of the crops day and night, he/she has the responsibility of protecting the plants from attack by animals such as rabbits etc. But he/she is not able to do that. So, he/she goes and plants into the middle of the field a straw-lump shaped like a [human] doll, with a black pot for a head, with its hands and feet mounted on bamboo. Seeing that horrifying and ugly form, rabbits and such destructive animals do not approach that field out of fear. It is as if the farmer has delegated to that doll the responsibility of looking after the farm. Thus, that doll is the overseer of that farm. It is like this with the activities and causalities of Prakriti. Even though [Purush] is extremely close to the events and still does not have any true contact, the events of actions and causalities are taking place in front of Purush’s eyes. Because of this, He is called the overseer (whether He actually looks or not).
 
That straw-lump doll – as it (even without actually doing anything) drives away the destructive animals from the farming-related plants of that farmer, [in essence] carrying out the work of the farmer, it is called “consenter/manager.” Similarly, even though Purush has no contact with the events of actions and causalities of Prakriti, because He surrounds Himself with Prakriti’s fence, and thereby imagines the entrapment of Consciousness in the physical, and because the operations of Prakriti go on manifesting, Purush becomes the “consenter/manager” of Prakriti.
 
A connection/relationship observed on Earth is this: the sun is up above, and in the pond on the ground floats the lotus. Because the lotus blooms when the sun comes up in the morning and closes when the sun goes down at dusk – just as poets have superimposed the relationship of “husband and wife” on that sun and lotus [respectively] – similarly, [upon] naming impermanence, ignorance, falseness and delusion as “Prakriti” and dressing it up as “wife,” the word “Purush” has been superimposed on the Eternal, Universal Brahman, and through the power of imagination, both have been “wed” and Purush has been dressed up as “lord.” The world is delusion’s home. In delusion’s home, there is only the delusional influence on a delusional household. Thus, there is the superimposition of an imaginary Prakriti imagining an imaginary Purush being an imaginary lord. Truth is the sustainer of the false. Truth is “Brahman” and the false is “Prakriti.” That is why Brahman is the “lord” of Prakriti.
 
“Bhokta” [consumer; experiencer]: “bhuj” = to do “bhojan” [consume] + “tr” (trin) = a sound denoting “doing” – meaning: the one who consumes. Just as darkness goes away automatically at the rising of the sun – in the same way, at the rising of the Knowledge of Brahman, the delusional web of Prakriti automatically merges into Brahman, and because of this, “Brahman is the consumer of Prakriti” – this false statement has been spread around.
 
This extremely incomprehensible and huge sheath of the universe that you are seeing in front of you, which is beyond the capabilities of the human mind to limit – all of this is nothing but the mutations and permutations of Prakriti. And even more, the one who brings about this universe by Her actions and causalities – that Prakriti Herself is so immense, not even a reflection of conception about that can come about in this tiny heart. Because Prakriti is bigger than everything, Prakriti is called “Mahan” [the Great]. The One in Whom She takes refuge and carries out the Rulership of this drama-garland – because that Purush is Her “Ishvara” [God], Purush is called “Maheshvara” [the God of “the Great”].
 
“Paramatma” [Supreme Self] – (the word “para” means “supreme,” and “am” means “only”) – meaning: the One Who is “Only,” “Supreme” and “Atma” [Self]; “AtmA shuddhah svayaṃjyotir vikAree nirAkṛtih” [the Self is the Pure Formless expression of the Self-luminous Light]. So there we have: the One who is “Only” (Alone), “Supreme,” “Pure,” “Self-luminous,” “Ruler” and “Formless” – that is the One Who is “Paramatma.”
 
O Arjuna! With this body, through becoming erroneous due to the error of contact with the phenomena of the activities and causalities of Prakriti (like a fence), Purush became dressed up with these stated particularities [attributes]. If it were not so, what He is – there is nothing left [any more] for you to know [about that] through analysis. Here you have your Prakriti, the mutations of Prakriti, the permutations, and Purush."
24,"The one who knows Purush to be like this, and [the one who knows] that Prakriti is with attributes – that one, even while being present in every kind of activity, does not again take birth.","The one who clearly knows oneself (one’s own Self – meaning; [the one who knows] the One Who is Pure, Self-luminous, Ruler, Formless – that One) in the aforementioned perspective, and clearly knows Prakriti and Prakriti’s qualities, operations and powers (it will not do to just know in some cursory way; whenever whatever vritti [tendency] arises, even without trying, one will automatically free one’s Purush state from the contact with Prakriti and easily laugh at it, just from the fruits of practice – when it will be like this, only then) – that person’s divisions of time, such as past and future, which have arisen due to the errors of Prakriti, will be destroyed, and a state where one is endlessly in the present at all times will come about. In this state, no rules or restrictions – none of that will be there. The reason is: because of that person having become “all is Brahman,” no functionalities that are seeds of rebirth will at all arise. That being will become “jivanmukta” [Liberated while living in the body]. Thus, no matter in which way he/she is on the outside, because of the absence of birth-causing impressions, that being will never have rebirth again."
25,"Some, through dhyana-yoga, come to know the Self through mental perception within the body. Some others come to know the Self through samkhya-yoga, and some others through karma-yoga.","(The words that have been said about Prakriti, the mutations of Prakriti, the permutations, and Purush – all of that can be known by simply witnessing the Self. In these two slokas [13:25-26] the Lord is showing the differences of the gradually greater levels of [spiritual] capability according to the stages of sadhana, and is speaking about the methods of witnessing the Self.)

When, upon having received instructions from Srigurudev, one progresses in sadhana and the force-strength of prana-driving in the sushumna becomes easy and natural, then, if one does 1728 chaturthik pranayams, the mind will rise up from the worldly experience and the senses, fall into the intellect, and one will have realization of the Self. That process of having Self-realization – that is called “dhyan.” Going on practicing in this way, when the world-oriented current of functionalities is completely controlled [by the sadhak], then, as one wishes, one can separate and take that current away from the weariness of Prakriti, fill it with energy, throw it into Purush and take up endless settledness. This is one type of sadhana [practice]. In this too, the settledness in the Self and the stoppage of the samsaric state come about. (The beginning part of this type of sadhana is “samkhya-yoga” – meaning: “jnana-yoga,” and the beginning part of samkhya-yoga is “karma-yoga.” That is why the Lord has mentioned samkhya-yoga and karma-yoga right after this [“dhyana-yoga”]. The perfected yogis take whichever one of these they wish and witness the Self; however, the practitioner is perfected by rising through the stages in sequence.) "
26,"However, some others who do not know (how to have realization of the Self, with Its signs as overseer and such, through paths such as samkhya-yoga and such), do worship upon hearing from others (meaning: from the scholars/sages). They too, upon taking refuge in the instructed wisdom, go beyond death. ","There are many persons whose gross nature is greater, and [thus] they have a lesser ability to ascertain subtle matters. They are not able to have realization of the Self Itself through paths such as samkhya-yoga and such. They become engaged in worship upon hearing from others – meaning: from scholars/sages. That teaching received from others is their proven wisdom [for progressing]. They themselves do not have discrimination. But they too, gradually, go beyond the death-enjoined samsara. This is because: with the aid of faith/reverence, and upon going on hearing that teaching, there is the gradual manifestation of devotion, which stops their outward-going tendencies. Then the outer teaching transforms into “Naad” [Divine Sound] within. Continuously listening to that Naad, the mind merges into the Vishnu-Substance."
27,"O Bharatarshabha [Arjuna]! All substances (things) that arise, from the inert to living beings – know that all of that happens due to the union of the field and the knower of the field.","That spiritual practice that was just spoken about, the one where Ishvara [the God aspect of a being] breaks through the fences of Prakriti and returns to Boundlessness, the one where the dharma of death (birth and death) is destroyed and Immortality is attained – its most subtle subject-matter (the primary practice) is the knowledge of the union of the field and the knower of the field. O Bharatarshabha [Arjuna]! O Arjuna! For as long as there is the delusional thinking that these two types of imaginary insubstantial things – “sthavar” (the non-moving things) and “jangam” (those that move about) – are eternal and true – meaning: “kshetra” [the field] (the happenings of Prakriti), and “kshetrajna” [knower of the field] (the fence of Maya around Brahman, [an idea that] cannot actually be conceived, [an idea] that is totally opposite in concept [to “kshetra”] and totally unrelated to the other [nonsense]) – [for as long as there is] no understanding of the difference between these two – know that for that long there is the union of the field and the knower of the field. It is like the fear that comes about when seeing elephants, horses, ghosts and ghouls in a dream, but there is no fear when one is awake – in the same way, upon the rising of the Knowledge of Brahman, there is no delusion that remains about some fence of Maya being around Brahman-Substance. Continuously analyzing (through intense practice) Prakriti, the mutations of Prakriti, the permutations, and the state of Purush, the delusion of the union of the field and the knower of the field is torn apart. The seed of rebirth does not remain. Know that this is the teaching of the ultimate practice in order for you to have Liberation. See its clear proof. The day that you sit down to do Kriya and no longer have the desire to attain the paravastha of Kriya, that is the very day that you attain that paravastha. And the days on which you keep that desire – no way does it happen on those days."
28,"The one who sees “Parameshvara” [Supreme God] as residing in all things in the same way, and as Indestructible when all phenomena are destroyed – that is the one who sees all.","“Param” means “only,” “supreme.” And “ishvara” means Brahman enjoined with Maya. There is no light in Prakriti; light is in Purush. The delusional desires, activities and knowing-power that rise up in Prakriti due to the contact with Purush – Prakriti puts those delusions into Purush, takes the light of Purush, dresses up Purush as “lord,” and dresses up Herself as self-luminous and non-doer – that dual-self state is called “Ishvara.” — Begin Footnote. — The iris of the eye is round and small. The amount of great space that can be captured by that power of sight that comes from that iris – that is actually “mahan” [great]. Because the place from which the power of sight issues forth is round – because of that, the amount of space that the sight can capture – all of it seems to be round. Who knows how many irises of eyes are there in that huge sphere; that cannot be counted; it cannot even be determined by thinking. In the same way, within the Totality of Brahman, the number of the spherical mazes [illusion] born of Maya that can be perceived – meaning: the union of Maya and Brahman – within that very area [in Brahman], due to the error of contact with the guna-endowed Maya and the progress of those gunas [qualities], [Brahman] takes the name of [or: becomes] “Saguna Brahman” [Brahman with attributes]. This Saguna Brahman is that which is known as “Ishvara” [personal God]. Within the area run by this Saguna Brahman, there are innumerable Maya-mutated universes and solar systems that have found their places, like those irises of the eyes. The sphere of the eye is far from the sky and is small. And within the Eternal, Unattributed Brahman, the unreal, pure Maya’s place of residence is a lie and is far from Ishvara and small. Because Ishvara has taken Maya as “His own,” He is called “Mayavashi” [under the power of Maya]. And as much as the Sky of Consciousness has come down towards Maya, that much of it is under the power of Maya. The state of being under the power of Maya is “jiva” [embodied soul]. In the particular ways that this jiva has come near Maya – according to those ways, it has taken names according to greater and lesser nearness to Maya, [names] such as gods, demons, humans, animals, birds, insects, plants, stones etc. — End Footnote. — The “Ishvara” that has “only-ness” and “supreme-ness” – that one is called “Parameshvara.” Just as: if a fortress is made with iron walls in the great space – that there is no fragmentation that takes place in space – in the same way, the smearing of Prakritic illusion or falsehoods does not touch Brahman. Even though, in the eyes of the ignorant, space appears to be divided by the walls of the fortress, in the eyes of the wise there is no fragmentation taking place in the great space. Just as [the wise one] sees the one undivided great space inside and outside mountains, walls, trees, stones [and such] – in the same way, the One Parameshvara is present equally, like undivided (without boundaries) space, within everything. Prakritic changes do not make that eternal truth change. The one who has the adeptness to see this – that is the one who sees that which is unknown to others. If the sadhak matches up his/her purvavastha [pre-state] of Kriya, Kriyavastha [during-Kriya-state], paravastha [post-state] of Kriya, and the paravastha of the paravastha of Kriya [post-post-state of Kriya], this delusion will not remain."
