Verse Index{hide},Pranab Gita Translation,Pranab Gita Commentary
29,"Because the person who sees the Supreme Self as abiding in the same way in everything/everywhere, and, therefore, as [that person] does not bring about his/her own destruction – for this reason, [that person] attains the Supreme Destination (Liberation).","The Brahman, Ishvara and Parameshvara that have been spoken about under the previous slokas – there is no place for anything to have any place in them. Because this is like that, there is no place to give instruction. There is no time; [so] there is no way to reveal something called “past” or “future.” Like a sheet of luminous fire-flame, only one Substance (Brahman) is there. This Beginning-less, Infinite Light Itself is “I” Myself. What Prakritic delusion can cause conflict in this Form of Myself? And what is the nature of such delusion? Where does it exist? Staying in an unbroken way in this state of Rulership, one cannot kill/damage oneself because there is no cutting up of the True by the false – meaning: one does not have to destroy the Knowledge “I am the Supreme Self” by coming down to the knowledge “I am the individual person.” One does not have to destroy oneself. Thus, the Supreme Goal (Settledness in Brahman) becomes established automatically."
30,"All actions are being done in every way by Prakriti alone, and the Self is the Non-doer. The one who sees this – that is the one who is the seer of Truth.","Just like little girls playing with their household-dolls in their playrooms are starting to learn the preparation for future enjoyments – in the same way, the first practice for the one who removes that self-killing Maya (that which destroys oneself), in order to reestablish oneself in the Form of the Self, is this enjoyable talk (that which teaches this and allows one to learn). The tri-guna-endowed Prakriti is the Maya [appearing play] of the Lord. Through actions and causalities, this Maya Herself shows Her limitation. Thus, doing and non-doing – She is the master of both of these. That is why the name is “Prakriti” [pro-doing]. Whatever associations of whatever kinds of actions, causalities and doership that may come – all of that verily is this enjoyment-loving Prakriti. “I” – that Infinite Light – am separate and nothing actually [connected to the play] – this direct knowledge is that which shows Oneself to be the Non-doer. The one who has attained this vision through special sadhana [spiritual practice] – that one is seeing Oneself as the Non-doer. "
31,"When one sees the [apparent] separateness of the aggregate of phenomena and living beings existing in a singular place (residing in the One Self), and when one sees that all phenomena and living beings expand forth from That Itself (from that One Self Itself), then (that being) becomes Brahman. ","“This, that, another” – these separate forms of phenomena and living beings that you are seeing – that is the dharma of Prakriti’s making and withdrawing. Removing this perception of separateness from the inner being, all phenomena and living beings become one and expand forth. And the great expanse is actually Brahman. That Brahman is verily “I”. When the spiritually knowledgeable sadhak [aspirant] performs the yajna of Brahman as described in the fourth chapter [of the Bhagavad Gita], then the perception of seeing the Self in all becomes established, and one sees that in the midst of the ocean, there are infinite waves giving off the foam and bubbles of phenomena which are established in One Self alone, and it is from the One Self that they are spreading out in many different forms. When this direct vision is had – it is then that the sadhak attains the State of Brahman."
32,"O Kaunteya [son of Kunti; Arjuna]! Because of beginning-less-ness and non-attributed-ness, this Supreme Self is Inexhaustible (the Ruler/Owner). For this reason, even while being in this body, It does nothing and is not enwrapped (by anything).","When the State of Brahman is attained, no conflicts of the body-associated pleasures and pains come about any longer. Only the vision of oneness remains. This is because: That which the Substance of the Supreme Self is – that is Beginning-less and Attribute-less. Therefore [It is] the Ruler. And the Prakritic substance is with beginning and with attributes; therefore [it is] mutation-oriented. For this reason, no marks can be impressed upon that Ruler (like smoke in the sky). That is why it can be said that there is no way for the fences of the attribute-enjoined, beginning-enjoined Prakriti to surround this Beginning-less, Attribute-less, Inexhaustible Supreme Self."
33,"Just as, because of its subtleness, the space that is everywhere is not enwrapped (by anything) – in the same way, even though the Self exists throughout the body, It is not enwrapped. ","That the Supreme Self is not enwrapped even while existing in the body – this is exemplified by space. See – space is everywhere. There is no place or thing in which space is not. Fill this space with smoke; blow dust on it; spray mud on it; try in whichever you can to put impurities on space; you will see that no mark can be made on the body of space. As soon as smoke, dust etc. go away, the same space remains just as space. This is because space is subtle in substance; it does not blend with the gross/physical. Just as this space is not enwrapped by/with anything, yet everything is present within it – just like that, because the Self is subtler than the subtlest, even though it is everywhere, in whatever bodies there are in the cosmos, it is not enwrapped by any actions/operations by anyone/anything."
34,"O Bharat [Arjuna]! Just as the one sun illuminates this entire world – in the same way, the Resider in the field (the Supreme Self) is illuminating the entire field.","O Bharat [Arjuna]! Just as the one sun is illuminating the entire world, yet is not bound to anything/anyone – in the same way, however many fields that there are, the One Resider of the fields (the Self) illuminates all fields, yet is not bound by them. "
{35}{stop},"In the [previously] stated ways, those who, through the eye of knowledge, know the distinctions between the field and the knower of the field, and know the method of Liberation of living beings from Prakriti – they go to the Supreme Truth (Brahman).","That field, the knower of the field, Prakriti, the mutations of Prakriti (phenomena/living beings), and Liberation – meaning: the talk that has been given regarding being apart while being in all of this – in this, that the knower of the field is totally separate from the field, Prakriti, and the mutations of Prakriti – this is proved by the scriptures. And that teaching in the scriptures is proved by the teachings of guru. And the one who vows to do sadhana according to the teachings of the scriptures and the teachings of guru, and thereby directly sees the distinctions between the field and the knower of the field, and directly sees the way to be Liberated from the rulership of Prakriti through methods such as meditation etc., and thus comes to be settled in the Awareness of Self-knowing – for as long as that being remains in the body – for that long that being is jivanmukta [Liberated while living in the body], and upon the dropping off of the body [physical death], [that being] merges into the Infinite Form of Oneself – meaning: into Brahman – and that being never again has rebirth."